{"canonicalization":{"canonicalization_digest":"sha256:ce1152a2ca7341a57539dcdcc90080d566b3c9bebc44276c2ba7af8edac3f505","canonicalization_id":"canonicalization-profile","canonicalization_version":"1"},"catalog":{"catalog_digest":"sha256:2adcf3c13b89f88c81a05368fd330fbc72fddcda91654433a04f8e21d75fdb11","catalog_id":"gen9ou-engine-capabilities","catalog_version":"1"},"classifier":{"classifier_id":"battlebelief-differential-classifier","classifier_source_digest":"sha256:c54ab4e530cb876555183dc001b26d7c78e08d08977ad12bc563b64db22ec732","classifier_version":"1","known_divergence_definitions":[]},"corpus_digest":"sha256:1f68c70b2a3310f2a735c7224a4eb7a017b647f19f9e228dfdbd4eb6033f7f2d","corpus_id":"gen9ou-differential","corpus_version":"1","coverage":[{"capability_id":"gen9.legality.move.selection","coverage_kind":"reviewed_fixture","fixture_ids":["move-legality"],"known_divergence_id":null},{"capability_id":"gen9.legality.switch.forced","coverage_kind":"reviewed_fixture","fixture_ids":["forced-switch"],"known_divergence_id":null},{"capability_id":"gen9.legality.switch.voluntary","coverage_kind":"reviewed_fixture","fixture_ids":["voluntary-switch"],"known_divergence_id":null},{"capability_id":"gen9.legality.terastallization.activation","coverage_kind":"reviewed_fixture","fixture_ids":["tera-activation"],"known_divergence_id":null},{"capability_id":"gen9.transition.chance.damage-roll","coverage_kind":"reviewed_fixture","fixture_ids":["damage-roll"],"known_divergence_id":null},{"capability_id":"gen9.transition.move.direct-damage","coverage_kind":"reviewed_fixture","fixture_ids":["direct-damage"],"known_divergence_id":null},{"capability_id":"gen9.transition.order.priority","coverage_kind":"reviewed_fixture","fixture_ids":["priority-order"],"known_divergence_id":null},{"capability_id":"gen9.transition.order.speed","coverage_kind":"reviewed_fixture","fixture_ids":["speed-order"],"known_divergence_id":null},{"capability_id":"gen9.transition.switch.active-slot","coverage_kind":"reviewed_fixture","fixture_ids":["switch-active-slot"],"known_divergence_id":null},{"capability_id":"gen9.transition.terastallization.damage","coverage_kind":"reviewed_fixture","fixture_ids":["tera-damage"],"known_divergence_id":null},{"capability_id":"gen9.transition.terastallization.type-change","coverage_kind":"reviewed_fixture","fixture_ids":["tera-type-change"],"known_divergence_id":null},{"capability_id":"gen9.transition.terminal.detection","coverage_kind":"reviewed_fixture","fixture_ids":["terminal-detection"],"known_divergence_id":null},{"capability_id":"gen9.transition.terminal.value","coverage_kind":"reviewed_fixture","fixture_ids":["terminal-value"],"known_divergence_id":null}],"fixtures":[{"fixture_digest":"sha256:62acd216ef74341a7f7d7d2c6aeb83e4188c7f0630ff1e6ba9714984fcfe3d45","fixture_id":"damage-roll","path":"fixtures/damage-roll.json"},{"fixture_digest":"sha256:b78dee615e5a24b87ef37b234fc0919f3074aadef7d4c3953415d21ff1e2f9cd","fixture_id":"direct-damage","path":"fixtures/direct-damage.json"},{"fixture_digest":"sha256:a55c216e0afdca6ae03a803572622ab15309de3bd0da19cfb651c2d1db8e7840","fixture_id":"forced-switch","path":"fixtures/forced-switch.json"},{"fixture_digest":"sha256:9673732b63f959b6daed0a367dd4efe83fc9cb5cf26afd6290fccc517b97edf5","fixture_id":"move-legality","path":"fixtures/move-legality.json"},{"fixture_digest":"sha256:bfb1dc231cedef60bde3d65dea8fd8921861d1dba6fee05dc231a846ca217c63","fixture_id":"priority-order","path":"fixtures/priority-order.json"},{"fixture_digest":"sha256:0c8059263806dda3c145793bbec8337b81b0a609588b38bd3f48c47955aa5e76","fixture_id":"speed-order","path":"fixtures/speed-order.json"},{"fixture_digest":"sha256:a7aacd373a7b5e9b8f72983fe48f307539e9ce4e69547c2ecead1b1bab0bee3f","fixture_id":"switch-active-slot","path":"fixtures/switch-active-slot.json"},{"fixture_digest":"sha256:63c5a3f50740818197a4540f1a3c154bc0d5b673a09bdf70016b1c4fcbd6e61b","fixture_id":"tera-activation","path":"fixtures/tera-activation.json"},{"fixture_digest":"sha256:0b1a331501bfbc40716c62567720d542fe5c1a00cd1d58570ff120f9f3326bc8","fixture_id":"tera-damage","path":"fixtures/tera-damage.json"},{"fixture_digest":"sha256:e6478cfae51fddd86de30aa56c776bf931f39778ff391071fb8cefc742d93f44","fixture_id":"tera-type-change","path":"fixtures/tera-type-change.json"},{"fixture_digest":"sha256:0b8b513202703612b2f59065db7c7113571cb109c75fc0332273775c3c6152b2","fixture_id":"terminal-detection","path":"fixtures/terminal-detection.json"},{"fixture_digest":"sha256:4953246f1e697ad62e6ec081e893f20d24e4f2dc3be73ccd7f0722963122d63e","fixture_id":"terminal-value","path":"fixtures/terminal-value.json"},{"fixture_digest":"sha256:d981fef1415fa5b76484e353feee95c295f9767783e895858f64a42370e83c75","fixture_id":"voluntary-switch","path":"fixtures/voluntary-switch.json"}],"normalization":{"profile_digest":"sha256:ce1152a2ca7341a57539dcdcc90080d566b3c9bebc44276c2ba7af8edac3f505","profile_id":"canonicalization-profile","profile_version":"1"},"ruleset":{"ruleset_digest":"sha256:f11dfee276a8addfea7b292b45b6bb5d823b1728a4b446776034f84e643e7fde","ruleset_id":"synthetic-gen9ou-ruleset-v1","snapshot":{"format_id":"gen9ou","ruleset_id":"synthetic-gen9ou-ruleset-v1","ruleset_version":1}},"schema_bindings":[{"schema_digest":"sha256:1f3678319c3b2a8ddcee3a369db7b4e4c8263ca78e2bdfde1dd7fbf2fa6d2095","schema_id":"urn:battlebelief:schema:evaluation:differential-corpus:v1","schema_version":1},{"schema_digest":"sha256:d66b95d3a0331c2066aed29b7fcc0d7ac4d78a4b5c5f9eee1f7b1ff255c262f2","schema_id":"urn:battlebelief:schema:evaluation:differential-fixture:v1","schema_version":1}],"schema_version":1}